{
  "schema_version": 1,
  "incident_id": "INC-20260813-1e3dd962e373",
  "status": "NORMALIZED",
  "severity": "SEV2",
  "occurred_at": "2026-08-13T12:00:00Z",
  "detected_at": "2026-08-13T12:00:00Z",
  "resolved_at": null,
  "source": {"provider": "local", "event": "test_failure"},
  "subject": {"component": "registration", "branch": "feature/signup"},
  "owner_summary_ru": "Проверка регистрации остановилась до публикации результата.",
  "symptom_original": "Тест регистрации получил ожидаемый ответ слишком поздно.",
  "impact": {"customer_visible": false, "summary_ru": "Новая версия не опубликована."},
  "environment": {"runtime": "python", "runtime_version": "3.12.13", "tool": "unittest", "tool_version": "stdlib"},
  "fingerprint": {
    "algorithm": "sha256-v1",
    "hash": "1e3dd962e3735608ae1e60ee03ec379736272abf79fdedd7559fedb68260c074",
    "components": {
      "failure_class": "test_assertion",
      "stage": "test",
      "tool": "unittest",
      "exit_code": 1,
      "stable_frames": ["tests/test_signup.py:test_registration"],
      "symptom": "тест регистрации получил ожидаемый ответ слишком поздно."
    }
  },
  "classification": {"type": "TEST_ASSERTION", "confidence": "VERIFIED", "evidence": ["exit_code=1"]},
  "redaction": {"status": "SANITIZED", "findings_count": 0, "finding_codes": []},
  "attempts": [],
  "provenance": {"source": "mandatory-ci", "head_sha": "cccccccccccccccccccccccccccccccccccccccc"},
  "cost_usage": {"monetary_cost": 0, "ai_api_used": false}
}
